<?xml version="1.0" encoding="UTF-8"?>
<houses xmlns="htt//www.example.org/houseStructures" schemaLocation="houseStructures.xsd">
  
  <!-- HOUSE -->
  <house id="homeA">
    <housename>Home</housename>
    <room id="ar1">
        <roomname>Living room</roomname>
        <light id="ar1l1">
            <itemName>Ceiling lights</itemName>
        </light>
        <light id="ar1l2">
            <itemName>Floor lamp</itemName>
        </light>
        <sensor id="ar1s1">
            <itemName>Temperature sensor</itemName>
        </sensor>
    </room>     
  </house>
  
  <!-- HOUSE -->
  <house id="">
    
  </house>
  
  <!-- HOUSE -->
  <house id="">
    <housename></housename>
    <room id="">
     
    </room>
    <room id="">
    
    </room>
  </house>
  
  <!-- HOUSE -->
  
  
  
</houses>
